{
  "$schema": "./scripts/feature-manifest.schema.json",
  "_comment": "Source of truth for the app's feature inventory and its test coverage. Humans edit this when adding/removing a feature. CI (scripts/check-feature-manifest.mjs) fails when code drifts from this file (new/removed endpoints, components, or dead test references) and regenerates the auto block in docs/APP-STATE.md. Tiers follow risk-based testing: critical = smoke-gated on every PR; important = regression suite; nice = best-effort; internal = tooling, not user-facing.",
  "tiers": {
    "critical": "Core user journey. If it breaks the app is unusable. Must have a behavioral smoke test gated on every PR.",
    "important": "Real user value, frequent use. Must have regression coverage.",
    "nice": "Enhancement or easter egg. Best-effort coverage.",
    "internal": "Tooling / ops. Not part of the user-facing product."
  },
  "coverageLegend": {
    "behavioral": "A test actually executes the feature's logic and asserts real behavior.",
    "mocked": "Tested through e2e/unit but the failure-prone layer is mocked away (e.g. silent audio).",
    "source-only": "Only verified by grepping source text (makeover-*.test.js); regressions that keep the same tokens pass.",
    "device-only": "Cannot run in Chromium-on-Linux CI; needs real Safari/iOS or a real device.",
    "none": "No automated coverage."
  },
  "features": [
    {
      "id": "poem-categorization",
      "name": "Poem categorization / Explore",
      "tier": "important",
      "userFacing": "Account menu -> Explore Poems: filter/browse poems by mood, topic, motif, cross-dimension family, emotional intensity, and 0-10 reading difficulty; tap a result to expand the full poem in place.",
      "entrypoints": [
        "src/components/CategoryExplorer.jsx",
        "src/components/category/FamilyPicker.jsx",
        "src/components/category/PoemResultsGrid.jsx",
        "src/services/database.js"
      ],
      "endpoints": ["GET /api/categories", "GET /api/poems/by-category"],
      "tests": {
        "unit": ["src/test/server.test.js"],
        "e2e": []
      },
      "deviceOnly": false,
      "coverage": "mocked",
      "gap": "server.test.js covers the enabled/disabled API paths with a mocked pool; no e2e yet for the Explore Poems UI (filter chips, in-place poem expand)."
    },
    {
      "id": "onboarding-preferences",
      "name": "Onboarding preference pickers",
      "tier": "nice",
      "userFacing": "Full-screen preference flow at /onboarding: pick moods, historical eras, then topics; the selection is saved to localStorage.onboardingPrefs and re-editable through PreferencesDrawer. Salvaged from PR #517 and rewired onto the shipped categorization taxonomy; gated behind FEATURES.onboardingPrefs and not on the app boot path.",
      "entrypoints": [
        "src/components/onboarding/OnboardingFlow.jsx",
        "src/components/onboarding/MoodPicker.jsx",
        "src/components/onboarding/EraPicker.jsx",
        "src/components/onboarding/TopicsPicker.jsx",
        "src/components/PreferencesDrawer.jsx",
        "src/services/categoryTags.js",
        "src/constants/eras.js"
      ],
      "endpoints": ["GET /api/categories"],
      "tests": {
        "unit": [],
        "e2e": []
      },
      "deviceOnly": false,
      "coverage": "none",
      "gap": "No automated coverage yet. Needs a unit test for the categoryTags adapter (dimension -> tag mapping, composite ids, empty pre-migration payload) and an e2e walk of /onboarding asserting the three steps persist to localStorage."
    },
    {
      "id": "taxonomy-tag-ui",
      "name": "Taxonomy tag UI (browse / filter / inspect)",
      "tier": "nice",
      "userFacing": "Tag surfaces salvaged from PR #517 and rewired onto the shipped categorization taxonomy: TagExplorer browses dimensions and values, TagFilterPanel/FacetedSearchPanel filter poems by them, TagBadge renders a value, and PoemTagEditor/TagAdminPanel inspect labels. Not yet mounted on a route - the two editor surfaces are read-only because the categorization API exposes no writes (see their TODO(write-api) blocks).",
      "entrypoints": [
        "src/components/tags/TagBadge.jsx",
        "src/components/tags/TagExplorer.jsx",
        "src/components/tags/TagFilterPanel.jsx",
        "src/components/tags/FacetedSearchPanel.jsx",
        "src/components/tags/PoemTagEditor.jsx",
        "src/components/tags/TagAdminPanel.jsx"
      ],
      "endpoints": ["GET /api/categories", "GET /api/poems/by-category", "GET /api/poems/search"],
      "tests": {
        "unit": [],
        "e2e": []
      },
      "deviceOnly": false,
      "coverage": "none",
      "gap": "No automated coverage. Components are ported but unmounted; add tests when a surface routes to them."
    },
    {
      "id": "poem-display",
      "name": "Poem display (Arabic + translation + transliteration)",
      "tier": "critical",
      "userFacing": "The poem renders with Arabic text, optional English translation and romanization, correct RTL and font.",
      "entrypoints": [
        "src/components/PoemCard.jsx",
        "src/components/HighlightedVerse.jsx",
        "src/app.jsx"
      ],
      "endpoints": [],
      "tests": {
        "unit": ["src/test/utils.test.jsx"],
        "e2e": ["e2e/user-flows.spec.js"]
      },
      "deviceOnly": false,
      "coverage": "behavioral",
      "gap": "Arabic font rendering (Amiri/Tajawal) differs prod vs CI; no visual regression."
    },
    {
      "id": "discover-random",
      "name": "Discover / random poem",
      "tier": "critical",
      "userFacing": "Tap the fire icon, press right arrow, or Surprise Me to load a new poem.",
      "entrypoints": ["src/components/DiscoverDrawer.jsx", "src/stores/actions/fetchPoem.js"],
      "endpoints": ["GET /api/poems/random"],
      "tests": {
        "unit": ["src/test/fetchPoem.test.js", "src/test/utils-extracted.test.js"],
        "e2e": ["e2e/user-flows.spec.js", "e2e/carousel.spec.js"]
      },
      "deviceOnly": false,
      "coverage": "mocked",
      "gap": "e2e routes /api/** to canned JSON; real server SERVING filters + exclude fallback only covered by server.test.js in isolation."
    },
    {
      "id": "poem-carousel",
      "name": "Same-poet carousel (swipe between poems)",
      "tier": "critical",
      "userFacing": "Swipe left/right to move between poems by the same poet; dots indicate position.",
      "entrypoints": ["src/components/PoemCarousel.jsx", "src/app.jsx"],
      "endpoints": ["GET /api/poems/by-poet/:poet"],
      "tests": {
        "unit": [],
        "e2e": ["e2e/carousel.spec.js"]
      },
      "deviceOnly": false,
      "coverage": "mocked",
      "gap": "carousel.spec skips silently when <2 dots populate; a broken carousel can pass as skipped."
    },
    {
      "id": "tts-playback",
      "name": "Listen / TTS playback (play, pause, resume)",
      "tier": "critical",
      "userFacing": "Press Listen to hear the poem recited; pause/resume; space bar toggles.",
      "entrypoints": ["src/stores/actions/togglePlay.js", "src/utils/liveAudioStream.js"],
      "endpoints": ["POST /api/ai/live-tts", "POST /api/ai/:model/:action"],
      "tests": {
        "unit": ["src/test/liveAudioStream.test.js", "src/test/makeover-tone.test.js"],
        "e2e": ["e2e/audio.spec.js", "e2e/tts-highlight.spec.js"]
      },
      "deviceOnly": false,
      "coverage": "source-only",
      "gap": "HIGHEST RISK. togglePlay.js (1025 lines, 105 branches) state machine is never executed behaviorally; makeover-tone asserts source text via regex; e2e runs on silent PCM with the streaming path aborted."
    },
    {
      "id": "tts-stop-on-swipe",
      "name": "Stop audio on poem swipe (no background audio)",
      "tier": "critical",
      "userFacing": "Swiping to another poem stops any playing recitation.",
      "entrypoints": ["src/app.jsx", "src/stores/actions/togglePlay.js"],
      "endpoints": [],
      "tests": {
        "unit": ["src/test/liveAudioStream.test.js", "src/test/stores.test.js"],
        "e2e": []
      },
      "deviceOnly": false,
      "coverage": "mocked",
      "gap": "Regressed in #552 on streaming/iOS players (no .state). liveAudioStream covers the streaming stop primitive; the togglePlay swipe path is not behaviorally tested."
    },
    {
      "id": "tts-voice-cycle",
      "name": "Voice cycle pill (change reciter voice)",
      "tier": "important",
      "userFacing": "Tap the mic pill to cycle through 30 voices; restarts playback in the new voice if active.",
      "entrypoints": ["src/constants/voices.js", "src/stores/uiStore.js", "src/app.jsx"],
      "endpoints": [],
      "tests": {
        "unit": ["src/test/voices.test.js"],
        "e2e": []
      },
      "deviceOnly": false,
      "coverage": "mocked",
      "gap": "voices.test covers nextVoice + persistence; the abort+restart race on mid-recitation switch is untested."
    },
    {
      "id": "tts-engine-switch",
      "name": "Switch TTS engine mid-recitation (Live / REST / Pro)",
      "tier": "important",
      "userFacing": "DebugPanel toggles engine; switching mid-recitation aborts cleanly and restarts.",
      "entrypoints": [
        "src/components/DebugPanel.jsx",
        "src/stores/uiStore.js",
        "src/stores/actions/togglePlay.js"
      ],
      "endpoints": [],
      "tests": {
        "unit": ["src/test/stores.test.js"],
        "e2e": []
      },
      "deviceOnly": false,
      "coverage": "none",
      "gap": "Source of #560/#558/#561. The orphaned-stream/abort path on engine switch has no behavioral test."
    },
    {
      "id": "tts-word-highlight",
      "name": "Word-by-word read-along highlight",
      "tier": "important",
      "userFacing": "The currently spoken word highlights and auto-scrolls; snaps to last word on completion.",
      "entrypoints": [
        "src/hooks/useTTSHighlight.js",
        "src/utils/audioWordTiming.js",
        "src/utils/wordTiming.js"